### ISSUE TITLE
ECONNRESET || No HomeKit Notifications on Status change

### ISSUE THREAD

**Issue by fatal1010** [iRayanKhan/homebridge-chamberlain#75]
Checking the logs, I see the following, is this a concern and what could be the cause?

0|homebrid | [11/17/2019, 00:54:28] [Garage Door] FetchError: request to https://api.myqdevice.com/api/v5/accounts/<Account_ID>/devices/<Device_ID> failed, reason: read ECONNRESET
0|homebrid |     at ClientRequest.<anonymous> (/usr/lib/node_modules/homebridge-chamberlain/node_modules/node-fetch/index.js:133:11)
0|homebrid |     at ClientRequest.emit (events.js:210:5)
0|homebrid |     at TLSSocket.socketErrorListener (_http_client.js:406:9)
0|homebrid |     at TLSSocket.emit (events.js:210:5)
0|homebrid |     at emitErrorNT (internal/streams/destroy.js:92:8)
0|homebrid |     at emitErrorAndCloseNT (internal/streams/destroy.js:60:3)
0|homebrid |     at processTicksAndRejections (internal/process/task_queues.js:80:21) {
0|homebrid |   name: 'FetchError',
0|homebrid |   message: 'request to https://api.myqdevice.com/api/v5/accounts/<Account_ID>/devices/<Device_ID> failed, reason: read ECONNRESET',
0|homebrid |   type: 'system',
0|homebrid |   errno: 'ECONNRESET',
0|homebrid |   code: 'ECONNRESET'
0|homebrid | }

# Info
iOS Version: 13.2.2
Plugin Version: latest
HomeBridge Version: latest
Node/Npm Version: 12.13 / 6.12

Also, this is probably related to iOS 13 (HomeKit just acting weird), but, I don't get consistent notifications on my phone when garage opens/closes...I sometimes randomly get an Open or Close status, but, very very sporadic.

Let me know.

**Comment by iRayanKhan** [comment]
Is there a chance you may have mistyped your login info?

**Comment by fatal1010** [comment]
No, this is randomly scattered in the error log file, sometimes once a day, sometimes multiple times a day ... the std output has the normal garage state change log lines in it and the Home app opens/closes the garage as expected.

Don't know if this is an issue or not, just thought I'd point it out to you that my error log has these entries.

As a side note, I don't receive any Home app alerts anymore though (or, again, very randomly sometimes that the garage has opened or closed), but I think it is related to iOS 13 (was working well in iOS 12).

**Comment by iRayanKhan** [comment]
Is there a chance you may have enabled "DND" for the Home App? I did that once for messages on accident. In Settings > Notifications > Home it should show. It seems like since it's scattered the request just fails. Issue #51 had a similar issue, and an update fixed it. I'll keep track of this.

**Comment by fatal1010** [comment]
Hey, nope, nothing in listed under Settings -> Notification -> Home...chalk it up to random request failures.

**Comment by xDiavelS** [comment]
I am also this exact same error message throughout my logs. Sometimes it happens multiple times in a row, other times it can be hours in between. The door still opens through HomeKit and Siri, so doesn't seem to be a major problem though.

**Comment by iRayanKhan** [comment]
If notifications never show, it means something is really wrong. If it was just a request failure, then the status would also not report in HomeKit. But since the Status does poll in HomeKit (As far as I can tell), it may be a Home App issue. Maybe re-adding the accessories may help?

**Comment by iRayanKhan** [comment]
@kbardai In the Home App, top Left Corner (Home Image), tap "Home Settings", select your home, then go to "Notifications", then "Doors and Locks". See if they were disabled.

**Comment by fatal1010** [comment]
The "Doors and Locks" notification is enabled.  I've tried turning it off and on again but the notifications are very sporadic, sometimes I get notifications/sometimes none.

I'll try your suggestion of removing homebridge and re-adding to see if that helps...dunno if I need to go all nuclear and clear accessories/cache from homebridge as well, maybe as last resort.

**Comment by iRayanKhan** [comment]
Hey @kbardai did anything work so far?

**Comment by fatal1010** [comment]
Hey,

Removed and re-added homebridge from home app, no success...still sporadic notifications for garage.
Removed accessories/persit, removed homebridge from home app, restarted, re-added homebridge to homeapp, setup all accessories again (PITA), still no success, sporadic notifications.

Imma chalk it up to iOS13 issues?

Edit: to clarify, garage is the only notification I have setup in Home app.

Take Care

**Comment by DMBlakeley** [comment]
I am seeing the same behavior, same iOS revision, random in occurrence. Just updated to nom version 6.13.2 and will monitor.

**Comment by fatal1010** [comment]
Just installed the Schlage Sense door (HomKit) and get alerts consistently and almost instantly (whether manually unlocking or through homekit or schlage app)...dunno why garage alerts are a hit/miss :/

Edit: to add, sometimes I get notifications when I open the Home App, notifications that should have gotten hour+ ago/etc.

Edit2: 
https://github.com/KhaosT/HAP-NodeJS/issues/543
https://github.com/nfarina/homebridge/issues/2160

**Comment by seldridge1** [comment]
I’m also having similar results re: status change notifications. Would estimate I’m only receiving a notification about 10% of the time the door is opened or closed whether I’m on WiFi or cellular.

**Comment by fatal1010** [comment]
Here are some debug log info when I opened/closed the garage...received no notifications on any device. The IPs listed below are homepods and/or iphones/macbook.  Also, let me know if this is getting off topic from the original post I made.

`Accessory [Homebridge] Processing characteristic set: [{"aid":2,"iid":10,"ev":true},{"aid":2,"iid":11,"ev":true}] +0ms
  Accessory [Homebridge] Registering Characteristic "Current Door State" for events +0ms
  Accessory [Homebridge] Registering Characteristic "Target Door State" for events +1ms
  EventedHTTPServer [::ffff:192.168.1.6] Sending HTTP event '2.10' with data: {"characteristics":[{"aid":2,"iid":10,"value":0}]} +11s
  EventedHTTPServer [::ffff:192.168.1.151] Sending HTTP event '2.10' with data: {"characteristics":[{"aid":2,"iid":10,"value":0}]} +1ms
  EventedHTTPServer [::ffff:192.168.1.7] Sending HTTP event '2.10' with data: {"characteristics":[{"aid":2,"iid":10,"value":0}]} +1ms
  EventedHTTPServer [::ffff:192.168.1.246] Sending HTTP event '2.10' with data: {"characteristics":[{"aid":2,"iid":10,"value":0}]} +0ms
  EventedHTTPServer [::ffff:192.168.1.167] Sending HTTP event '2.10' with data: {"characteristics":[{"aid":2,"iid":10,"value":0}]} +1ms
[12/7/2019, 15:59:49] [Garage Door] doorstate changed from closed to open
  EventedHTTPServer [::ffff:192.168.1.6] Sending HTTP event '2.11' with data: {"characteristics":[{"aid":2,"iid":11,"value":0}]} +2ms
  EventedHTTPServer [::ffff:192.168.1.151] Sending HTTP event '2.11' with data: {"characteristics":[{"aid":2,"iid":11,"value":0}]} +1ms
  EventedHTTPServer [::ffff:192.168.1.7] Sending HTTP event '2.11' with data: {"characteristics":[{"aid":2,"iid":11,"value":0}]} +1ms
  EventedHTTPServer [::ffff:192.168.1.246] Sending HTTP event '2.11' with data: {"characteristics":[{"aid":2,"iid":11,"value":0}]} +1ms
  EventedHTTPServer [::ffff:192.168.1.167] Sending HTTP event '2.11' with data: {"characteristics":[{"aid":2,"iid":11,"value":0}]} +0ms
 EventedHTTPServer [::ffff:192.168.1.6] Sending HTTP event '2.10' with data: {"characteristics":[{"aid":2,"iid":10,"value":1}]} +2m
  EventedHTTPServer [::ffff:192.168.1.151] Sending HTTP event '2.10' with data: {"characteristics":[{"aid":2,"iid":10,"value":1}]} +1ms
  EventedHTTPServer [::ffff:192.168.1.7] Sending HTTP event '2.10' with data: {"characteristics":[{"aid":2,"iid":10,"value":1}]} +1ms
  EventedHTTPServer [::ffff:192.168.1.167] Sending HTTP event '2.10' with data: {"characteristics":[{"aid":2,"iid":10,"value":1}]} +0ms
  EventedHTTPServer [::ffff:192.168.1.246] Sending HTTP event '2.10' with data: {"characteristics":[{"aid":2,"iid":10,"value":1}]} +1ms
[12/7/2019, 16:05:17] [Garage Door] doorstate changed from open to closed
  EventedHTTPServer [::ffff:192.168.1.6] Sending HTTP event '2.11' with data: {"characteristics":[{"aid":2,"iid":11,"value":1}]} +2ms
  EventedHTTPServer [::ffff:192.168.1.151] Sending HTTP event '2.11' with data: {"characteristics":[{"aid":2,"iid":11,"value":1}]} +1ms
  EventedHTTPServer [::ffff:192.168.1.7] Sending HTTP event '2.11' with data: {"characteristics":[{"aid":2,"iid":11,"value":1}]} +0ms
  EventedHTTPServer [::ffff:192.168.1.167] Sending HTTP event '2.11' with data: {"characteristics":[{"aid":2,"iid":11,"value":1}]} +1ms
  EventedHTTPServer [::ffff:192.168.1.246] Sending HTTP event '2.11' with data: {"characteristics":[{"aid":2,"iid":11,"value":1}]} +1ms
[12/7/2019, 16:05:17] [Garage Door] desireddoorstate changed from open to closed`

**Comment by iRayanKhan** [comment]
Personally I'm a few revisions behind of this plugin on my main setup since it works for me (pretty sure it goes as far as the last V4 Api version I updated) so I can try this version with the V5 Api and see if there's more to it.

**Comment by twentyNoise** [comment]
> Edit: to add, sometimes I get notifications when I open the Home App, notifications that should have gotten hour+ ago/etc.
> 

These are all the same issues I’ve been seeing since I installed this plugin a few years back. It may be worse in iOS 13 but always been an issue. I first posted about it here: https://github.com/caseywebdev/homebridge-chamberlain/issues/40

Been trying to get to the bottom of it for a while.

**Comment by joker1138** [comment]
Same issues, same iOS.  Usually early in the morning will get the error in home bridge.  On Homekit, if I press all the items that are "no response", they eventually reconnect.  Of course, restarting home bridge clears everything up.

**Comment by hepcat72** [comment]
I have the same log errors, however I disabled the notifications (they're reliable from the MyQ app). I ended up here to figure out what I needed to do to quiet the errors.

**Comment by iRayanKhan** [comment]
Seeing as this is becoming more widespread and splitting into more issues here's what I propose:

For the lack of notifications can you please confirm the following:
- Notifications aren't silenced by iOS:
``` Settings -> Notifications -> Home```
Ensure everything is as expected, and there is a special tab in blue text called "Home Notification Settings), make sure your Doors, Locks, Windows, and Garages are either on/off to your liking. 

I would like more logs please. If possible in your current environment, run home bridge with the debug flag.
```
Homebridge -D
```
I would like a reply of the most recent debug output.
I also would like:
- Node Version:
```
Node -V
```
- NPM version:
```
 Npm -v
```
Also the current home bridge version.

I would like more logs and more environment info from other people to see if I can isolate a common variable or condition. 

Also please let me know what your environments are, like the platform and hardware you are running this on. I want to see if y'all can rollback your installation version as a temporary fix since an older version works for me. (Away from home atm, but will report back my version).


I appreciate y'all for bringing this to my attention and I am working as hard as I can to fix this for y'all.

Enjoy y'alls new year!

**Comment by hepcat72** [comment]
> I would like more logs please. If possible in your current environment, run home bridge with the debug flag.
> 
> ```
> Homebridge -D
> ```
> I would like a reply of the most recent debug output.

It may take awhile to get the error, so it's not like I can stop homebridge, and manually run that on the command line and see the error.  I've been wanting to regularly run homebridge with the -D flag for awhile for other reasons, but if you run homebridge using pm2, like me, I don't know how to supply that flag and have the process managed (i.e. restart if it quits, start up on boot, etc).  I would need that if I'm going to be running it this way long enough to get that error in this debug mode.

(I'd paste current non -D logs, but I'm VNC'd in ATM and the clipboards aren't linked.)

> I also would like:
> 
> * Node Version:
> 
> ```
> Node -V
> ```

```
>node -v
v11.12.0
```

> * NPM version:
> 
> ```
>  Npm -v
> ```

```
>npm -v
6.13.4
```

> Also the current home bridge version.

```
>homebridge --version
0.4.49
```

> I would like more logs and more environment info from other people to see if I can isolate a common variable or condition.

Can you be more specific?

> Also please let me know what your environments are, like the platform and hardware you are running this on.

rPi 3
jesse

> I want to see if y'all can rollback your installation version as a temporary fix since an older version works for me. (Away from home atm, but will report back my version).
> I appreciate y'all for bringing this to my attention and I am working as hard as I can to fix this for y'all.
> 
> Enjoy y'alls new year!

Happy New Year to you as well.

**Comment by dqtech** [comment]
I have the same ECONNRESET issue and also experience sporadic HomeKit Notifications when opening and closing the garage door. 

**IOS Home App Notifications:**
Using iOS 13.2.2. I checked this an I have notifications enabled for the garage door. I also have a Schlage Sense Lock and it notifies me consistently. The big difference here is the lock is native HomeKit compatible and not using homebridge. 

**Hardware**
I am running CoreELEC v9.2.1 on an X96 Android Box. The X96 uses an Amlogic S905X (arm64v8) with 1GB RAM.  

**Environment:**
```
/homebridge # uname -a
Linux CoreELEC 3.14.29 #1 SMP Wed Nov 27 06:02:54 GMT 2019 aarch64 GNU/Linux
```

**Versions:**
Homebridge is running in a docker container (oznu/homebridge) with host networking setup.
```
/homebridge # node -v
v12.14.0
/homebridge # npm -v
6.13.4
/homebridge # homebridge --version
0.4.50
```

**Log File:**
Here is a standard log file showing lots of examples of this ECONNRESET error.
I am running homebridge with the debug (-D flag) as I reply to this post, but the ECONNRESET error hasn't popped up yet. I will reply with the log file once the error occurs.  

[homebridge.log](https://github.com/caseywebdev/homebridge-chamberlain/files/4038489/homebridge.log)

Originally I first tried out the homebridge-myq2 plugin to connect to my Chamberlain Smart Garage Door Hub. Myq2 functions to open/close the door in the Home App, but notifications didn't work reliably.  This is how I came across this plugin -I wanted to see if the homebridge-chamberlain plugin would give me consistent notifications.

Scanning through the attached log file, it appears that myq2 also suffers from ECONNRESET issues even though it looks like they are using v4api.

One last thing to note. I also have an old iPhone 5c running iOS 10. The garage door open/close notifications are consistent. Strange eh?!

**Comment by iRayanKhan** [comment]
Two things I can think of at the moment.
(Please read the whole thing before doing any of this as there's multiple workarounds for each workaround.)
When I get home I will supply the version of the plugin I am using for my main setup.
The fact it works on iOS furthers my theory about HomeKit no response issues.

If possible, clear Persist and cachedAccessories, unpair bridge from HomeKit, make a new HomeKit Home, see if notifications show there.
If you can't remove the bridge from your HomeKit home due to having multiple plugins, make another instance of this plugin. Steps here:
```
mkdir GarageTestBridge
cd GarageTestBridge/
nano config.json 
(If on non command line systems, drag and drop your config.json file here with only the chamberlain plugin in the config).
Then start this new instance of HomeBridge by doing: homebridge -U ~/GarageTestBridge/ 
(Cases Matter)
Add this new HomeKit bridge to your new HomeKit home, and see if you can get notifications. 
```
Be sure to change the homebridge Username, port, and name, (set-up pin code is fine as default) for the new Config file. 

Reasoning:
I had a HomeKit home created in iOS 11.4 and users I shared the home with started having major issues where they couldn't control accessories locally or remotely. My assumption, was that with big HomeKit app changes with new iOS updates, something didn't convert properly for a iOS 13 version home. Also I recommend staying away from older iOS devices for your HomeKit home. I had tried to use an old iPad (runs iOS 10.3.3 max), as a HomeKit hub instead of the Apple TV's or HomePods, and it converted my light switches to Garages, and swapped all accessory states and ended up breaking my home. So If Making a new HomeKit Home works and the notifications along with it, it means it just have been a migration issue Apple is yet to fix in iOS for new Home.app versions. 
I fixed my issues by making a new HomeKit home, and factory resetting All HomeHubs and it's been flawless so far. I plan to raise a feedback ticket with Apple to address this since I had an open Support case for now 7-8 months regarding HomeKit instability. Sorry to the mini rant, but here's a 

>tldr; iOS migration issues cause home.app to not make HomeKit's core functions work, and making a new HomeKit home worked for me.

**Comment by iRayanKhan** [comment]
Thanks for the logs @dqtech I noticed that you have homebridge-tplink-smarthome, I have this plugin too and you have to declare something for that plugin or this method to add a new homebridge instance won't work. I have a config just for this I will send in 4 or so hours.

I am doing more research on ECONNRESET, but since it's not that major as compared to Garage notification states, the priority is the notifications.
Edit:
I noticed that this error as stated happens every once in a while and at max happens 3 times a day, or once every day within the same time span. Do the times in the logs mean anything to you like, do you check the Home App during this time, or have anyone arrive then? I want to see if this is just background polling that fails, and the request just re-requests it's self.

**Comment by iRayanKhan** [comment]
Hey @hepcat72, thanks for the reply.
> but if you run homebridge using pm2, like me, I don't know how to supply that flag and have the process managed
>>
I also run PM2 on my environment too, I managed to get pm2 to run homebridge using the -U flag (specified folder), using a shell script to start PM2 in that certain instance, I'll send the file (it's 2 lines long), and how to have PM2 use the ```-D``` Flag. I know the ```-U``` flag works, ```-D``` should too.

**Comment by rajbala** [comment]
I also have the ECONNRESET issues sporadically through the logs.

```
/homebridge # node -v
v12.14.0
/homebridge # npm -v
6.13.4
/homebridge # homebridge --version
0.4.50
/homebridge #
``` 

I am running Homebridge in a Docker container on a RPi4 with 4GB of RAM.  Happy to help debug this if I can.

**Comment by iRayanKhan** [comment]
So I was working on some tweaks for this plugin to make getting the version info and such easier, anyways I am using V1.0.6 of the plugin. I will upgrade to V1.0.8 and get back with y'all tonight and see if notifications work. 

Also thank you everyone for replying and providing logs and such I appreciate it a lot.

I am hoping to have this issue resolved within a week, it also seems to be non-severe (the ECONNRESET) since it's just seems like an API call back failure and it resend a request. But the notifications thing is a big deal 'cuz that's a big integration part in HomeKit.  ```V1.0.9``` will maybe suppress this error if that's what fixes it, and ```V1.10.0``` or may just call it ```V2.0``` will add Accessory info in the Home App to report plugin version (good for debugging), and add light controller support if I can make it info one plugin and not 2 branches, will still release the other branch.

**Comment by iRayanKhan** [comment]
Has anyone tried making a new Home and trying notifications?

**Comment by DMBlakeley** [comment]
If you startup Homebridge without defining a "deviceID" in the config.json file you receive an error "Multiple controllable devices found". In my case with 1 garage door opener 2 devices are reported. Both seem to work although one is shown in the "myQ" app on my iPhone. I was using the second device reported and receiving the errors previously reported. Have now switched to the first device reported and monitoring for errors.

Is there a difference between the 2 reported devices?

**Comment by DMBlakeley** [comment]
No luck ... already received following error with alternate deviceID:
```
[1/15/2020, 10:28:54 AM] [Garage Door] FetchError: request to https://api.myqdevice.com/api/v5/accounts/4a7c96bd-0609-4770-90e4-b6d45f87a98e/devices/GW0A0006841A failed, reason: read ECONNRESET
    at ClientRequest.<anonymous> (/usr/local/lib/node_modules/homebridge-chamberlain/node_modules/node-fetch/index.js:133:11)
    at ClientRequest.emit (events.js:223:5)
    at TLSSocket.socketErrorListener (_http_client.js:406:9)
    at TLSSocket.emit (events.js:223:5)
    at emitErrorNT (internal/streams/destroy.js:92:8)
    at emitErrorAndCloseNT (internal/streams/destroy.js:60:3)
    at processTicksAndRejections (internal/process/task_queues.js:81:21) {
  name: 'FetchError',
  message: 'request to https://api.myqdevice.com/api/v5/accounts/4a7c96bd-0609-4770-90e4-b6d45f87a98e/devices/GW0A0006841A failed, reason: read ECONNRESET',
  type: 'system',
  errno: 'ECONNRESET',
  code: 'ECONNRESET'
}
```

**Comment by iRayanKhan** [comment]
So to confirm for everyone; is econnreset just a warning that a request failed, but then it re-requests and starts responding in HomeKit, or complete no response 100% api fails?

**Comment by seldridge1** [comment]
@iRayanKhan, the former is my experience.

**Comment by DMBlakeley** [comment]
@iRayanKhan request that fails and then re-requests. API does not fail.

**Comment by madmattd** [comment]
@iRayanKhan For me, it would work for a while, then drop out, but it seemed to take too long to come back up. Did some searching and poking, looks like updating the api.js from ApiVersion: '4.1', to ApiVersion: '5.1', might resolve this.

**Change:**
const req = ({body, headers, method, pathname, query}) =>
  fetch(url.format({host, pathname, protocol, query}), {
    body: body == null ? body : JSON.stringify(body),
    headers: _.extend({
      'Content-Type': 'application/json',
      'User-Agent': 'myQ/14041 CFNetwork/1107.1 Darwin/19.0.0',
      ApiVersion: '5.1',
      BrandId: '2',
      Culture: 'en',
      MyQApplicationId
    }, headers),
    method
  }).then((res) => {
    if (res.status < 200 || res.status >= 300) {
      return res.text().then(body => {
        throw new Error('invalid response, got HTTP ' + res.status + ': ' + body)
      })
    }
    return res.text()
  }).then(data => {
    if (data) {
      return JSON.parse(data);
    } else {
      return null
    }
  });

**From my log:**
[1/16/2020, 3:40:01 AM] [Garage Door] FetchError: request to https://api.myqdevice.com/api/v5/accounts/.... failed, reason: read ECONNRESET
    at ClientRequest.<anonymous> (C:\Users\Matt\AppData\Roaming\npm\node_modules\homebridge-chamberlain\node_modules\node-fetch\index.js:133:11)
    at ClientRequest.emit (events.js:223:5)
    at TLSSocket.socketErrorListener (_http_client.js:406:9)
    at TLSSocket.emit (events.js:223:5)
    at emitErrorNT (internal/streams/destroy.js:92:8)
    at emitErrorAndCloseNT (internal/streams/destroy.js:60:3)
    at processTicksAndRejections (internal/process/task_queues.js:81:21) {
  name: 'FetchError',
  message: 'request to https://api.myqdevice.com/api/v5/accounts/.... failed, reason: read ECONNRESET',
  type: 'system',
  errno: 'ECONNRESET',
  code: 'ECONNRESET'
}
[1/16/2020, 4:44:50 AM] [Garage Door] FetchError: request to https://api.myqdevice.com/api/v5/accounts/.... failed, reason: read ECONNRESET
    at ClientRequest.<anonymous> (C:\Users\Matt\AppData\Roaming\npm\node_modules\homebridge-chamberlain\node_modules\node-fetch\index.js:133:11)
    at ClientRequest.emit (events.js:223:5)
    at TLSSocket.socketErrorListener (_http_client.js:406:9)
    at TLSSocket.emit (events.js:223:5)
    at emitErrorNT (internal/streams/destroy.js:92:8)
    at emitErrorAndCloseNT (internal/streams/destroy.js:60:3)
    at processTicksAndRejections (internal/process/task_queues.js:81:21) {
  name: 'FetchError',
  message: 'request to https://api.myqdevice.com/api/v5/accounts/.... failed, reason: read ECONNRESET',
  type: 'system',
  errno: 'ECONNRESET',
  code: 'ECONNRESET'
}
[1/16/2020, 12:07:38 PM] [Garage Door] FetchError: request to https://api.myqdevice.com/api/v5/accounts/.... failed, reason: connect ETIMEDOUT #.#.#.#:443
    at ClientRequest.<anonymous> (C:\Users\Matt\AppData\Roaming\npm\node_modules\homebridge-chamberlain\node_modules\node-fetch\index.js:133:11)
    at ClientRequest.emit (events.js:223:5)
    at TLSSocket.socketErrorListener (_http_client.js:406:9)
    at TLSSocket.emit (events.js:223:5)
    at emitErrorNT (internal/streams/destroy.js:92:8)
    at emitErrorAndCloseNT (internal/streams/destroy.js:60:3)
    at processTicksAndRejections (internal/process/task_queues.js:81:21) {
  name: 'FetchError',
  message: 'request to https://api.myqdevice.com/api/v5/accounts/.... failed, reason: connect ETIMEDOUT #.#.#.#:443',
  type: 'system',
  errno: 'ETIMEDOUT',
  code: 'ETIMEDOUT'
}

**Comment by madmattd** [comment]
spoke too soon, just got the ECONNRESET error again.

> @iRayanKhan For me, it would work for a while, then drop out, but it seemed to take too long to come back up. Did some searching and poking, looks like updating the api.js from ApiVersion: '4.1', to ApiVersion: '5.1', might resolve this.
> 
> **Change:**
> const req = ({body, headers, method, pathname, query}) =>
> fetch(url.format({host, pathname, protocol, query}), {
> body: body == null ? body : JSON.stringify(body),
> headers: _.extend({
> 'Content-Type': 'application/json',
> 'User-Agent': 'myQ/14041 CFNetwork/1107.1 Darwin/19.0.0',
> ApiVersion: '5.1',
> BrandId: '2',
> Culture: 'en',
> MyQApplicationId
> }, headers),
> method
> }).then((res) => {
> if (res.status < 200 || res.status >= 300) {
> return res.text().then(body => {
> throw new Error('invalid response, got HTTP ' + res.status + ': ' + body)
> })
> }
> return res.text()
> }).then(data => {
> if (data) {
> return JSON.parse(data);
> } else {
> return null
> }
> });
> 
> **From my log:**
> [1/16/2020, 3:40:01 AM] [Garage Door] FetchError: request to https://api.myqdevice.com/api/v5/accounts/.... failed, reason: read ECONNRESET
> at ClientRequest. (C:\Users\Matt\AppData\Roaming\npm\node_modules\homebridge-chamberlain\node_modules\node-fetch\index.js:133:11)
> at ClientRequest.emit (events.js:223:5)
> at TLSSocket.socketErrorListener (_http_client.js:406:9)
> at TLSSocket.emit (events.js:223:5)
> at emitErrorNT (internal/streams/destroy.js:92:8)
> at emitErrorAndCloseNT (internal/streams/destroy.js:60:3)
> at processTicksAndRejections (internal/process/task_queues.js:81:21) {
> name: 'FetchError',
> message: 'request to https://api.myqdevice.com/api/v5/accounts/.... failed, reason: read ECONNRESET',
> type: 'system',
> errno: 'ECONNRESET',
> code: 'ECONNRESET'
> }
> [1/16/2020, 4:44:50 AM] [Garage Door] FetchError: request to https://api.myqdevice.com/api/v5/accounts/.... failed, reason: read ECONNRESET
> at ClientRequest. (C:\Users\Matt\AppData\Roaming\npm\node_modules\homebridge-chamberlain\node_modules\node-fetch\index.js:133:11)
> at ClientRequest.emit (events.js:223:5)
> at TLSSocket.socketErrorListener (_http_client.js:406:9)
> at TLSSocket.emit (events.js:223:5)
> at emitErrorNT (internal/streams/destroy.js:92:8)
> at emitErrorAndCloseNT (internal/streams/destroy.js:60:3)
> at processTicksAndRejections (internal/process/task_queues.js:81:21) {
> name: 'FetchError',
> message: 'request to https://api.myqdevice.com/api/v5/accounts/.... failed, reason: read ECONNRESET',
> type: 'system',
> errno: 'ECONNRESET',
> code: 'ECONNRESET'
> }
> [1/16/2020, 12:07:38 PM] [Garage Door] FetchError: request to https://api.myqdevice.com/api/v5/accounts/.... failed, reason: connect ETIMEDOUT #.#.#.#:443
> at ClientRequest. (C:\Users\Matt\AppData\Roaming\npm\node_modules\homebridge-chamberlain\node_modules\node-fetch\index.js:133:11)
> at ClientRequest.emit (events.js:223:5)
> at TLSSocket.socketErrorListener (_http_client.js:406:9)
> at TLSSocket.emit (events.js:223:5)
> at emitErrorNT (internal/streams/destroy.js:92:8)
> at emitErrorAndCloseNT (internal/streams/destroy.js:60:3)
> at processTicksAndRejections (internal/process/task_queues.js:81:21) {
> name: 'FetchError',
> message: 'request to https://api.myqdevice.com/api/v5/accounts/.... failed, reason: connect ETIMEDOUT #.#.#.#:443',
> type: 'system',
> errno: 'ETIMEDOUT',
> code: 'ETIMEDOUT'
> }

**Comment by DMBlakeley** [comment]
Have been searching other posts on this problem and wonder if the SecurityToken is expiring between polls of MyQ? 

Reference this [posting](https://github.com/arraylabs/pymyq/issues/22#issuecomment-518861064). Believe current implementation of home bridge-chamberlain is consistent but don't know the answer to the SecurityToken.

Also learned from a discussion on [stackoverflow.com](https://stackoverflow.com/questions/17245881/node-js-econnreset):

> "ECONNRESET" means the other side of the TCP conversation abruptly closed its end of the connection. This is most probably due to one or more application protocol errors. You could look at the API server logs to see if it complains about something.
> 
> What could also be the case: at random times, the other side is overloaded and simply kills the connection as a result. If that's the case, depends on what you're connecting to exactly…

**Comment by iRayanKhan** [comment]
@DMBlakeley very helpful, thank you for that info. 
I guess there was more to the V5 Api upgrade than we thought... Working on a fix, but if anyone can reverse the API again for me and see if it accepts any new user-agents or other info please tag me.

**Comment by fatal1010** [comment]
@iRayanKhan 

Below is to try to resolve notifications issue, as you said, the econnreset is minor.

on iOS/HomeApp - All my notifications are on/active (not silenced)
Node  v12.14.0
npm v6.13.4
homebridge v0.4.5
iOS v13.3.1 (same on homepods)

Running homebridge in debug mode doesn't give any additional information...during this test I did not receive any notifications on any devices.

`pi@raspberrypi:~/.homebridge $ DEBUG=*
pi@raspberrypi:~/.homebridge $ homebridge -D
[1/29/2020, 21:57:01] Loaded config.json with 1 accessories and 1 platforms.
[1/29/2020, 21:57:01] ---
[1/29/2020, 21:57:01] Loaded plugin: homebridge-chamberlain
[1/29/2020, 21:57:01] Registering accessory 'homebridge-chamberlain.Chamberlain'
[1/29/2020, 21:57:01] ---
[1/29/2020, 21:57:01] Loaded plugin: homebridge-tplink-smarthome
[1/29/2020, 21:57:01] Registering platform 'homebridge-tplink-smarthome.TplinkSmarthome'
[1/29/2020, 21:57:01] ---
[1/29/2020, 21:57:01] Loading 1 platforms...
[1/29/2020, 21:57:01] [TplinkSmarthome] Initializing TplinkSmarthome platform...
[1/29/2020, 21:57:01] [TplinkSmarthome] homebridge-tplink-smarthome v4.0.1, node v12.14.0, homebridge v0.4.50
[1/29/2020, 21:57:02] [TplinkSmarthome] config.json: {"platform":"TplinkSmarthome","name":"TplinkSmarthome","timeout":10,"switchModels":["HS200","HS210"]}
[1/29/2020, 21:57:02] [TplinkSmarthome] config: {"platform":"TplinkSmarthome","name":"TplinkSmarthome","timeout":10,"switchModels":["HS200","HS210"],"addCustomCharacteristics":true,"deviceTypes":[],"discoveryOptions":{"discoveryInterval":10000,"deviceTypes":[],"deviceOptions":{"defaultSendOptions":{"timeout":10000}},"macAddresses":[],"excludeMacAddresses":[]},"defaultSendOptions":{"timeout":10000}}
[1/29/2020, 21:57:02] Loading 1 accessories...
[1/29/2020, 21:57:02] [Garage Door] Initializing Chamberlain accessory...
...
... lots of lines for tplink
...
[1/29/2020, 21:57:29] [Garage Door] doorstate changed from closed to open
[1/29/2020, 21:57:29] [Garage Door] desireddoorstate changed from closed to open
[1/29/2020, 21:58:12] [Garage Door] doorstate changed from open to closed
[1/29/2020, 21:58:12] [Garage Door] desireddoorstate changed from open to closed
[1/29/2020, 21:58:43] [Garage Door] doorstate changed from closed to open
[1/29/2020, 21:58:43] [Garage Door] desireddoorstate changed from closed to open
[1/29/2020, 21:59:24] [Garage Door] doorstate changed from open to closed
[1/29/2020, 21:59:24] [Garage Door] desireddoorstate changed from open to closed
[1/29/2020, 21:59:30] Got SIGINT, shutting down Homebridge...`

looking at the code (although I don't understand it 100%), I don't see where the value for doorstate is being set by you (I see the desireddoorstate.setValue) ... and I don't know if the issue is related to using setValue and instead we should use Characteristic.updateValue()? (see the two links I posted above in my previous post)

Also, do we need a return here?: https://github.com/caseywebdev/homebridge-chamberlain/blob/09a9712c7bcac68a2eb3a1db17426bc40f4055a8/src/chamberlain-accessory.js#L67

Thanks for looking into.

Take Care

**Comment by iRayanKhan** [comment]
I can look into this, but the main issue is it works for me, and I can't test to see if it work for y'all. 
If anyone is willing to run their chamberlain instance on another Pi (I have one someone can connect to), and see if a fresh install fixes it, then we can try that. 

Edit:

Only reason I mention running it on another Pi, is to see if something is cached from your homebridge instance on your device.

**Comment by DMBlakeley** [comment]
I was reviewing the posted article that I referenced above and believe that there may be an error in api.js, line 140. I changed from:

`pathname: '/api/v5/accounts/' + AccountId + '/devices/' + MyQDeviceId,`

to:

`pathname: '/api/v5.1/Accounts/' + AccountId + '/devices/' + MyQDeviceId,`

Note the capitalization of “Accounts”. I have only been running now for a few hours without error but the error seems to be random and would consider 24 hours without an error a success.  Will update.

——

UPDATE - unfortunately no dice. After a few hours received the same FetchError resulting in a ECONNRESET.

**Comment by jsrivatsan** [comment]
I have the same issues with inconsistent notifications and ECONNRESET errors in the log file. I am running homebridge on rpi 3B. I will send you the logs and environment info tomorrow.

**Comment by iRayanKhan** [comment]
@DMBlakeley Thanks for the update. 

I currently don't have a phone to add my Garages to HomeKit in, would anyone be willing to try untested changes this weekend?

**Comment by iRayanKhan** [comment]
I also had one other thing,
If you can, make a new HomeKit home, and add your garages to it and see if you get the notifications. 
Also, if possible, running this plugin on a new device (no prior files), and in a new HomeKit home would eliminate this being a Home app issue.

**Comment by iRayanKhan** [comment]
Has anyone had a chance to try the suggestions above?
I am eager to resolve this issue asap to ensure a smooth transition to 5.1.

**Comment by DMBlakeley** [comment]
I have been experiencing connection issues with this app as well as the Ring and Alarm.com plug-ins so I did not rush to do additional tests. Noticed today that Node.js was updated to v12.15.0 and have updated my configuration to see if there are any changes in behavior.

UPDATE - didn't take long to get the ECONNRESET error from the `getDeviceAttribute(options = {})` routine.

**Comment by jsrivatsan** [comment]
I tried making a new home and adding this plugin. I have been testing this setup for the past two days and the inconsistency is still there. I have not tested on a different device yet. I need to convince my wife on using her device and I have not had much success there :-(

**Comment by DMBlakeley** [comment]
I have been looking into the "Fetcherror" and "ECONNRESET" errors which I have been getting from this plugin. 

I compared the routines in the api.js routine to other implementation of myQ including a recent one that I found which controlled the garage door through a Shortcut on my iPhone. The implementation of checking status, opening, and closing the door were pretty consistent other than the question if you should be using v5 or v5.1 in the calls. There was one location in api.js, line 154, where I changed `v5` to `v5.1` and this did not resolve the issue but also did not seem to break any functionality.

While searching for causes of "Fetcherror" I learned that this can be the result of too frequently polling the server. I only ever had this problem with the garage door closed for several hours and the plugin was polling the myQ servers to determine the garage door status. The error always occurred in the `getDeviceAttribute` subroutine.

This train of thought led me to look at the chamberlain-accessory.js routine. Line 6 was `const IDLE_DELAY = 1000 * 10;` which I changed to `const IDLE_DELAY = 1000 * 11;` to reduce the polling frequency. Yes, a small amount but it appears to be significant. Almost 24 hours since making this change and I have not seen an error. Prior to this change I would see the error 2 to 3 times per day.

As reference I am on node v12.15.0 and npm v6.13.7.

Does this make sense?

**Comment by DMBlakeley** [comment]
Received an error after about three 36 hours. Bumped from 11 to 12 on the iDLE_DELAY. Can't seem to find any details on minimum poll time for api.myqdevice.com.

Looks like I must have just been lucky. Changed multiplier to 12 then 13. Both produced errors. Suppose I was a bit optimistic.

**Comment by iRayanKhan** [comment]
Thanks for investigate work @DMBlakeley. 

I did a fresh install (was forced) and now notifications are broken for me too. I still get them, I just have to open the home app, or sometimes they don't deliver. 

I wonder if it is a dependancy issue, or iOS 13. Maybe even this ECONNRESET issue. 

Is there a chance setting the delay to *15 or even *20 fix it? When using the shortcut does it limit polls or use a different user agent?

**Comment by DMBlakeley** [comment]
I did try *15 and even *20. Both resulted in errors. Seemed to go a bit crazy yesterday getting 20+ errors in an hour when I changed the multiplier back to *11.

Yesterday I found this reference on [openHAB](https://www.openhab.org/v2.5/addons/bindings/myq1/) for myQ which indicates that "refresh" should be set at "60000" and "quick refresh" after an event is triggered should be set to "2000". This is the only reference I have been able to find on the required intervals.

Based on this reference I have changed the multiplier to *60. Still in the monitoring phase but not long enough to claim victory.

From my investigation, "Fetcherror" is the error and ECONNRESET is the response from the myQ servers. I want to say the error is not connected with iOS13 as Homebridge via this plugin (running on a Mac mini in my case) is interfacing with api.myqdevice.com and sending the status requests or change in state commands. Homekit also runs on the Mac now which also seems to eliminate iOS13 as the cause.

Will give you an update on the *60 multiplier.

**Comment by DMBlakeley** [comment]
Over 36 hours with multiplier at *60 and no FetchError from Chamberlain plugin. Have noticed that change in state (closed-opening-open) are not necessarily logged realtime when door is opened manually through wall button or Home connect in car. Will try reducing multiplier in *10 increments to see when errors start occurring.

UPDATE: Back to *60 and monitoring for errors. Didn't take long at *50 for an error to occur.

**Comment by DMBlakeley** [comment]
I have posted a pull request to api.js which I believe addresses this issue. I found that the header for requests to api.myqdevice.com may have not been formatted correctly. 

I am not a programmer by profession but I did notice that the header was different when compared to the [homebridge-myq2](https://github.com/hjdhjd/homebridge-myq2) plugin. I have used an IDLE_DELAY multiplier of *30 and *15 without issue. Default value is *10 which is less than is probably needed in practice. Also realized that the MyQ app on your smart phone as well as the Amazon Key app are also pinging the myqdevice.com server so you don't want the multiplier too short.

**Comment by DMBlakeley** [comment]
Withdrew pull request as not 100% effective. Due to randomness of occurrence wonder if error is a result of 2 apps submitting a status request at some time. As noted above, Homebridge, MyQ app and Amazon Key app all poll MyQ through my account.

**Comment by iRayanKhan** [comment]
I'm going to try your PR tomorrow. I am installing a door lock tomorrow morning in the Garage, and want it to where it unlocks when the garage door opens, update statuses are not consistent for me currently, and notifications have broken for me too. 


Edit:
I only use this plugin to control these devices, so maybe it could work or me since no other app would be polling.

**Comment by DMBlakeley** [comment]
I am continuing to run the patch with IDLE_DELAY multiplier at *30.

UPDATE: Have been running a couple of days now with the patch and *30 multiplier and have 1 error per day which is a significant reduction *30 multiplier is also sufficient to pick up requested changes in door state.

**Comment by fatal1010** [comment]
@iRayanKhan moved from homebridge install on rpi4 to HOOBS on ubuntu server...installed the plugin (listed as hoobs certified) and still very sporadic notifications with a brand new install.  I added it to existing home, not a new home.  

As for the idle_delay, if you do increase the multiplier, please make it configurable.

**Comment by iRayanKhan** [comment]
I will push a release soon to set the ```idle_delay``` via config.

**Comment by TheEngineerGuy** [comment]
Hi guys, thinking about this plugin. Do we know if this issue has been resolved? @iRayanKhan

**Comment by iRayanKhan** [comment]
Hi @TheEngineerGuy,
So I will leave it up to the user to decide how long the idle_delay should be as suggested by @kbardai. 
I am looking for other plugins that may use another approach to get status from Chamberlain, but no dice so far. Expect a beta in 2 or 3 days.

**Comment by DMBlakeley** [comment]
I did quite a bit of investigation and your implementation was consistent with them. Have multiplier at *30 and still get an occasional error about once per day.

**Comment by TheEngineerGuy** [comment]
Thanks @iRayanKhan Looking forward to the Beta. Yes, for now we can set it configurable with default value of *30 as @DMBlakeley suggests.

**Comment by fatal1010** [comment]
> I am looking for other plugins that may use another approach to get status from Chamberlain, but no dice so far. Expect a beta in 2 or 3 days.

@iRayanKhan 
Getting the status is fine, I think the econnreset is a minor issue...but something is up with homebridge (or hap) and iOS 13.3+ and notifications...native homekit locks/devices send notifications as expected.

I finally gave up on myQ/homebridge for my garage and bought a iSmartGate from amazon...installed it this morning and haven't missed a notification yet for any open/close events.

Hopefully the sporadic issues w/ the notifications gets figured out.

Take Care

**Comment by fatal1010** [comment]
@iRayanKhan if you are also having the notification issue, have you looked into my previous posts/links suggesting to use updateValue instead of setValue?

https://github.com/KhaosT/HAP-NodeJS/issues/543
https://github.com/nfarina/homebridge/issues/2160

**Comment by DMBlakeley** [comment]
I could only find one location that "setValue" was used. This was line 81 of src/chamberlain-accessory.js. I have changed this to "updateValue" and monitor for any additional occurrences of the error. I have observed no issues with garage door operation with this change.

**Comment by iRayanKhan** [comment]
Here the road map with this plugin

- Light Controller
- Fix for ECONNRESET
- Obstruction Detection

I can make a beta and publish it to NPM on Sunday to change the value via config, but it won't be based off the light_controller branch (yet).

**Comment by TheEngineerGuy** [comment]
Sounds good @iRayanKhan .

**Comment by DMBlakeley** [comment]
Sounds good. I went for days without an ECONNRESET and then had 1 yesterday and 1 today. Just really strange.

**Comment by iRayanKhan** [comment]
@DMBlakeley If you make another PR with the changes you did I can merge it in so people can have a proper hardcoded update value.

**Comment by fatal1010** [comment]
@iRayanKhan I don't know if it's just as simple as changing the setValue to updateValue ... look at the links I pasted above and code in the comments.

I know you said you were having sporadic notifications as well, did this resolve it?

**Comment by iRayanKhan** [comment]
I was using a beta obstruction detection branch and changing the value appeared to work. This issue may re-open once obstruction detection gets added since idk how much polling will be done to see if it's obstructed. I just published the release to NPM if anyone would like to also leave their feedback. I appreciate the links you sent @kbardai. This should work if not then I guess manual config setting will be a solution.

**Comment by DMBlakeley** [comment]
The change to updateValue did not seem to increase the occurrence of the ECONNRESET and also did not impact operation. From reviewing the first article in particular the use of "update" over "set" was the recommended process.

**Comment by iRayanKhan** [comment]
Is this issue resolved for y'all? I get notifications all the time now.

**Comment by DMBlakeley** [comment]
I started getting a different ECONNRESET error as below. Believe that this is due to using "v5.1" versus "v5" in request for accounts data. I changed the line in api.js which triggered this error and so far no errors. If remains quiet will submit pull request to make change.

`[3/20/2020, 3:15:12 PM] [Garage Door] FetchError: request to https://api.myqdevice.com/api/v5/accounts/4a7c96bd-0609-4770-90e4-b6d45f87a98e/devices/CG085031Fxxx failed, reason: read ECONNRESET
    at ClientRequest.<anonymous> (/usr/local/lib/node_modules/homebridge-chamberlain/node_modules/node-fetch/lib/index.js:1455:11)
    at ClientRequest.emit (events.js:311:20)
    at TLSSocket.socketErrorListener (_http_client.js:426:9)
    at TLSSocket.emit (events.js:311:20)
    at emitErrorNT (internal/streams/destroy.js:92:8)
    at emitErrorAndCloseNT (internal/streams/destroy.js:60:3)
    at processTicksAndRejections (internal/process/task_queues.js:84:21) {
  message: 'request to https://api.myqdevice.com/api/v5/accounts/4a7c96bd-0609-4770-90e4-b6d45f87a98e/devices/CG085031F642 failed, reason: read ECONNRESET',
  type: 'system',
  errno: 'ECONNRESET',
  code: 'ECONNRESET'
}`

**Comment by TheEngineerGuy** [comment]
Hey guys, for push notifications, did we try to reverse engineer the communication to:
connect.myqdevice.com &
connect1.myqdevice.com

**Comment by iRayanKhan** [comment]
Nice find @TheEngineerGuy. If someone wants to wire shark those domains and see what can be used it would help a lot.

**Comment by TheEngineerGuy** [comment]
My Problem is that I use a Fortinet, and it processes these packets via NPU, so the CPU never sees them to capture. I have tried disabling NPU, and then trying to capture, and it gives me like 10% of them. Which don't make any sense to me. 

I wonder if anyone here has a router than can do TCPdump but doesn't have an NPU.

**Comment by iRayanKhan** [comment]
Just published the new PR to NPM.

**Comment by twentyNoise** [comment]
I’m still not receiving all notifications. But MyQ is still consistently sending through that App.

I also recently updated to most recent Node and NPM.

I received a Door Open just now but no close notification.

Homebridge log shows closed to open and then open to close state.

**Comment by TheEngineerGuy** [comment]
You must be onto something. I was on Node.js v10 and everything was functioning, updated Node.js to v13 yesterday, and MyQ notifications are still working, but home kit notifications stopped (open and close). Doesn't matter if I open or close via homekit, MyQ App or garage door button.

Since the status correctly updates on homekit Icon, it seems that polling of status still works, but once status is polled and it has changed, either notification doesn't get generated, or doesn't get sent out.

**Comment by iRayanKhan** [comment]
I saw on Reddit, people who have Native HomeKit garage door openers, also get either ghost notifications, or none at all. So either this is a HomeKit issue, or something that no one has figured out to implement correctly. The strange thing is, notifications worked great before.
Edit:
Maybe there are new open/close states? They used to be different, then changed to what we have now.

**Comment by DMBlakeley** [comment]
I am on node.js v12.16.1 and npm v6.14.3 and am getting notifications for both opening and closing.

Also started getting a range of errors this afternoon seeming to indicate issues with communication with the server as I am getting error 503 - service unavailable. With much increased load on the internet I guess I am not surprised with getting some communication errors.

**Comment by TheEngineerGuy** [comment]
Hmm... But if there were new states, then the Icon wouldn't change, would it? Because I see the status reflect correctly on the icon, even when I used physical button to open and close the garage door.

**Comment by TheEngineerGuy** [comment]
Hmm... Is there a safe way to downgrade Node.js version? I have never had to do that. I would like to see how it works with v12.

**Comment by DMBlakeley** [comment]
Here is what I found:

- when changing garage door via Home app the icon state changes with the door position and I get notifications.
- when I change the garage door via the button the icon state change is delayed (remember 30 second polling) but does catch up and I get notifications.
- so I changed polling to 15 seconds for curiosity and icon state change delay is reduced but I don’t get notifications ... strange.

In all cases the log shows the change in garage door state correctly.

**Comment by TheEngineerGuy** [comment]
Ok, good find. I didn't tweak the poling rate, mine is default, which I assume we set to 30 secs, right?

**Comment by DMBlakeley** [comment]
Yes, the PR I submitted a couple days ago changed the default to *30.

**Comment by iRayanKhan** [comment]
Are you using ipv6 when you get your 503 error? 
Just curious as I had some issues on an ipv6 server getting 503 on sites

**Comment by TheEngineerGuy** [comment]
Ok, I updated my NPM version to reflect yours, from 6.13.3 to 6.14.3 via "sudo npm install -g npm@latest"

now when I run "npm list -g --depth 0"
I get "/usr/lib
└── npm@6.14.3"

none of my npm packages are showing up. WTF!!!

**Comment by iRayanKhan** [comment]
Try the path 
```/usr/lib/node_modules```

**Comment by TheEngineerGuy** [comment]
Shows me only NPM there!! 

"$ls /usr/lib/node_modules
npm"

**Comment by iRayanKhan** [comment]
does 
```ls -a```
return anything?
and it's an L not an I, (just saying incase ppl don't know)

**Comment by TheEngineerGuy** [comment]
Just adds the . and .. files
ls -a /usr/lib/node_modules
.  ..  npm

**Comment by TheEngineerGuy** [comment]
Funny enough, my homebridge and other homebridge plugins are working.

**Comment by iRayanKhan** [comment]
Are you using linux?
What if you tried the find command (I think it's Whereis or find?)

**Comment by iRayanKhan** [comment]
Also if you have discord, the homebridge server has a spot for chamberlain if it'd be easier to discuss there, or we could keep it here since all prior info is here.

**Comment by TheEngineerGuy** [comment]
Using rpi buster, so debian.

**Comment by iRayanKhan** [comment]
I use raspian. Does sudo make a difference by chance? I'm just throwing any suggestions I can
```sudo ls -a```
or go into super user into the node_modules directory.

**Comment by TheEngineerGuy** [comment]
I can try that. Running sudo find -L / -name 'homebridge-chamberlain' right now.

**Comment by TheEngineerGuy** [comment]
Found them, they are sitting at: "/usr/local/lib/node_modules/". Did new version change the directory?

EDIT: Should I move them to the other directory?
EDIT 2: Looks like my NPM Prefix has magically changed from /usr/local to /usr. So now, all my global module installations are going to /usr/. What could change that?

**Comment by TheEngineerGuy** [comment]
@DMBlakeley when you run "npm prefix -g", what do you get?

Edit: And what do you get when you run "npm list -g --depth 0"

**Comment by xDiavelS** [comment]
I had this same thing happen to me when I upgraded node. Now I have some
plugins in "usr/loc/lib/node_modules" and some in "usr/lib/node_modules".
I've been trying to figure out the best way to fix this up for a while now.
I have deleted some of the plugins from  "usr/lib/node_modules" as when I
now install using sudo npm i -g homebridge-......, it installs in
"usr/loc/lib/node_modules".

**Comment by TheEngineerGuy** [comment]
I wonder if notifications for me are failing due to truncated NPM modules (after my node.js update lastnight) which were installed global, but are no longer in new global prefix.

**Comment by iRayanKhan** [comment]
I just upgraded to a HomeKit router, so my garages need to have the Wi-Fi changed. At the moment I can't test anything. 

My theory may be, with the new npm upgrade, does something have to change with the package.json?

Just to see if we can pin point a source it would be nice if everyone provided the following.

HomeBridge Version, Chamberlain Plugin Version, Node Version, NPM version, and OS.

**Comment by TheEngineerGuy** [comment]
Will do @iRayanKhan and I will do some more TShoot on my end to see if I can figure this out.

**Comment by DMBlakeley** [comment]
> @DMBlakeley when you run "npm prefix -g", what do you get?
> 
> Edit: And what do you get when you run "npm list -g --depth 0"

Here is what I get:

`Blakeleys-Mac-Mini:~ Blakeleys$ npm prefix -g
/usr/local
Blakeleys-Mac-Mini:~ Blakeleys$ npm list -g --depth 0
/usr/local/lib
├──  error: ENOENT: no such file or directory, open '/usr/local/lib/node_modules/Automator/package.json
├── homebridge@0.4.53
├── homebridge-camera-ffmpeg@0.1.13
├── homebridge-chamberlain@1.6.0
├── homebridge-config-ui-x@4.13.0
├── homebridge-nest@4.4.4
├── homebridge-node-alarm-dot-com@1.4.3
├── homebridge-platform-wemo@1.3.8
├── homebridge-ring@7.2.1
└── npm@6.14.3

npm ERR! error in /usr/local/lib/node_modules/Automator: ENOENT: no such file or directory, open '/usr/local/lib/node_modules/Automator/package.json'
npm ERR! invalid: googleapis@18.0.0 /usr/local/lib/node_modules/homebridge-camera-ffmpeg/node_modules/googleapis`

**Comment by TheEngineerGuy** [comment]
Bingo!!! I think my prefix change when I updated node.js last night definitely screwed me over. Does anyone know how to correct the npm prefix?

EDIT: Trying "npm config set prefix /usr/local" to see if it fixes my woes.

**Comment by twentyNoise** [comment]
```
npm prefix -g
/usr/local

npm list -g --depth 0
/usr/local/lib

homebridge@0.4.53
homebridge-chamberlain@1.6.0
npm@6.14.3

node -v
v12.16.1

iOS
13.3.1

Homebridge Mac OS
10.14 Mojave
```

FYI my node_modules directory has always been in this location - for the past few years over multiple versions of npm and node.

**Comment by TheEngineerGuy** [comment]
HomeBridge Version: 0.4.53
Chamberlain Plugin Version: 1.6.0
Node Version: v13.11.0
NPM version: 6.13.7
OS: Raspbian GNU/Linux 10 (buster)

Ok. I fixed the prefix issue, by reinstalling node+npm all modules, but that have me no luck. However, when I reset my homebridge persist and accessories folders, I get the notification for OPEN once in a while.

As you can see from the output below, I have no errors, and status is correctly being reflected in homebridge.
[2020-03-23, 6:06:01 p.m.] [Garage Door] doorstate changed from closed to open
[2020-03-23, 6:06:01 p.m.] [Garage Door] desireddoorstate changed from closed to open
[2020-03-23, 6:06:32 p.m.] [Garage Door] doorstate changed from open to closed
[2020-03-23, 6:06:32 p.m.] [Garage Door] desireddoorstate changed from open to closed

However, Running TCPDump in parallel I found the following:

Communication when OPEN status occurs:
18:06:01.750078 IP raspberrypi.34876 >  iphone.52262: Flags [P.], seq 3134472640:3134472784, ack 3350271448, win 506, options [nop,nop,TS val 949976902 ecr 642882635], length 144
18:06:01.790790 IP  iphone.52262 > raspberrypi.34876: Flags [.], ack 144, win 2045, options [nop,nop,TS val 642942342 ecr 949976902], length 0
18:06:01.790857 IP raspberrypi.34876 >  iphone.52262: Flags [P.], seq 144:288, ack 1, win 506, options [nop,nop,TS val 949976943 ecr 642942342], length 144
18:06:01.792782 IP  iphone.52262 > raspberrypi.34876: Flags [.], ack 288, win 2045, options [nop,nop,TS val 642942344 ecr 949976943], length 0

Communication when CLOSE status occurs:
18:06:32.027814 IP raspberrypi.34876 >  iphone.52262: Flags [P.], seq 288:432, ack 1, win 506, options [nop,nop,TS val 950007180 ecr 642942344], length 144
18:06:32.102101 IP  iphone.52262 > raspberrypi.34876: Flags [.], ack 432, win 2045, options [nop,nop,TS val 642972626 ecr 950007180], length 0
18:06:32.102153 IP raspberrypi.34876 >  iphone.52262: Flags [P.], seq 432:576, ack 1, win 506, options [nop,nop,TS val 950007254 ecr 642972626], length 144

So, it seems like my phone and homebridge are on speaking terms, but somehow notifications are not showing up.

**Comment by twentyNoise** [comment]
I found this: [https://community.home-assistant.io/t/homekit-notifications-ios-13-issue/154649](url)

And so I tried enabling Notifications in 10.14 on my Mac mini (which is running Homebridge). I just tested the door and I didn't receive ANY on my Phone (iOS 13) but received both Open and Close notifications in Mojave.

Though I am positive I was having this issue back in iOS 12 as well.

**Comment by twentyNoise** [comment]
I found this: [https://community.home-assistant.io/t/homekit-notifications-ios-13-issue/154649](url)

So I tried enabling Notifications in 10.14 on my Mac Mini (which is running Homebridge). I just tested the door and I didn't receive ANY on my Phone (iOS 13) but received both Open and Close notifications in Mojave.

I am positive I was having this issue back in iOS 12 as well so while the link above states it's iOS 13, I'm not sure that's the whole story.

I'll leave the notification enabled in Mojave as the Mac Mini is always on and I'll check it every so often looking for both Open and Close notifications.

Let me add that another computer of mine running Catalina has the same spotty notifications as my iPhone running iOS 13. That is, earlier when I received JUST the Door Open on my iPhone, I also received JUST the Door Open in Catalina. When I just tested with Mojave - neither my iPhone nor Catalina received the Notifications (Mojave received both).

All these tests have been using the Garage Door Opener button that is wired to the Opener.

If this IS a HomeKit bug, then it's strange that it would only effect a Garage Door because I receive other notifications just fine.

Along those lines, would it be possible to create a version of this plugin that does NOT use the Garage Door Accessory but instead just uses a generic Contact Sensor? At least for testing. Or changing the code to avoid anything associated with 'this being a Garage Door' vs some generic sensor.

UPDATE: Once again Mojave received the Open & Close notifications, and my iPhone received none.

**Comment by TheEngineerGuy** [comment]
What did Apple change to make it not work anymore? I know that home app on Mojave is not getting updates anymore. They must have changed something in new apps.

@twentyNoise do you have other devices notifying via homebridge to Catalina and iOS? I am wondering if this is a homebridge push notifications issue, or plugin notification issue.

**Comment by twentyNoise** [comment]
@TheEngineerGuy Good point, I do not. I just setup a notification for two different devices from two different Homebridge plugins. We’ll see.

**Comment by TheEngineerGuy** [comment]
So I found something. 

I often use discovery app to sniff MDNS devices. I didn’t use it since yesterday, and now I see that homebridge is no longer visible under _hap._tcp. I think this is certainly homebridge related. 

To my knowledge, all HomeKit devices must be listed under this sub domain for notifications to work correctly.

**Comment by twentyNoise** [comment]
@TheEngineerGuy mine are all still listed under _hap._tcp.

**Comment by TheEngineerGuy** [comment]
So your homebridge is in there? Hmmm.... I wonder why mine is not in there. I recall that it used to be in there.

**Comment by iRayanKhan** [comment]
Maybe it's not in there because of a Bonjour issue? 
I don't know if it makes a difference, but I just got a HomeKit router so I'd assume Bonjour traffic isn't denied. In the Home App I set the restriction to none for HomeBridge.

**Comment by TheEngineerGuy** [comment]
My Bonjour is routing fine. I have multicast forwarding enabled between VLANs, which is what Bonjour runs on (224.0.0.251 multicast group). 

To take Multicast forwarding out of the equation, I connected directly yo RPi VLAN, I still don't see Homebridge in _hap._tcp. So, I will reinstall Homebridge again today, to see if that fixes it.

**Comment by twentyNoise** [comment]
Quick Update

homebridge-hue plugin is currently 100% with Notifications for a Motion Sensor in iOS 13.

homebridge-node-alarm-dot-com is about as poor as the Chamberlain plugin regarding notifications. Last night I received an 'Arm' notification but NO disarm this morning. The Alarm.com app gave me its own native notifications. I just tried arming / disarming again and I only received an Arm notification in Catalina, but nothing on my iPhone. This was in iOS 13 & Catalina. _I DID receive both the Arm / Disarm notifications in Mojave_.

Also of note is that it does NOT seem to be related to the Security Accessory in HomeKit because I have a separate native HomeKit Alarm that gives me Arm / Disarm notifications 100% of the time.

**Comment by DMBlakeley** [comment]
iOS 13.4, iPadOS 13.4, TvOS 13.4 and MacOS 10.15.4 just went live. May want to update before digging in too much.

**Comment by iRayanKhan** [comment]
I will update my Mac shortly. I don't know if this may be relevant, but my HOmePod's automatically updated to iOS 13.4 so I don't know if Home Hubs will be an issue. I will also update my Apple TV's too.

**Comment by iRayanKhan** [comment]
I asked Erik of the homebridge-hue plugin, and he said this:
```
Afaik notifications are handled by iCloud.  The Home hub should maintain an open connection to Homebridge.  The plugin should send an update to the home hub, using characteristic.setValue() or similar.  The home hub then syncs the update to iCloud.
I personally use notifications for door sensors, motion sensors, and window covering devices.  To iOS, iPadOS, and macOS.  iOS displays them on my Apple watch when the iPhone is sleeping.
The notification settings are per device, not synced.
```

**Comment by twentyNoise** [comment]
I was going to ask Erik myself, hah.

If I still receive the notifications fine in Mojave then one would assume my HomeHub / AppleTV is functioning properly and communicating with iCloud correctly.

**Comment by seldridge1** [comment]
FWIW, I broke down and bought a MyQ Home Bridge about a week ago - have not had any notification issues since.

**Comment by TheEngineerGuy** [comment]
I could have given you mine. That hub is crap over VLANs, I have to source NAT my home network IP addresses for multicast communications, to make it work.

**Comment by twentyNoise** [comment]
@TheEngineerGuy did you get the MyQ Home Bridge working then? Did you have any notification issues?

Still 100% notifications from homebridge-hue in iOS 13. Mojave also 100% from Chamberlain plugin.

if @seldridge1 isn't having any notification issues any longer, homebridge-hue seems fine, chamberlain has issues as does homebridge-node-alarm-dot-com etc. I'm leaning towards a plugin issue somehow pertaining to the latest updates to HomeKit etc. But if Erik isn't doing anything specific to get notifications working then I'm still at a loss here.

I have yet to do any of the new updates that were released today.

@iRayanKhan should we assume that Erik is saying that he 'does not' have any issues with notifications? I'm guessing the sensors he's talking about are at least partially from Homebridge.

**Comment by TheEngineerGuy** [comment]
> Afaik notifications are handled by iCloud.  The Home hub should maintain an open connection to Homebridge.  The plugin should send an update to the home hub, using characteristic.setValue() or similar.  The home hub then syncs the update to iCloud.

This is only true if devices are not connected to the homenetwork. 

For devices connected to the homenetwork, it is a unicast communication sent by homebridge directly to the device, as shown in the TCPDump paste in my previous note.

**Comment by TheEngineerGuy** [comment]
> @TheEngineerGuy did you get the MyQ Home Bridge working then? Did you have any notification issues?

That thing is a POS, works sometimes, but then goes into "not responding" state. Sitting in my basement in its brand new box.

**Comment by twentyNoise** [comment]
> For devices connected to the homenetwork, it is a unicast communication sent by homebridge directly to the device, as shown in the TCPDump paste in my previous note.

Ah that's right - I remember reading it somewhere: when you're on your home network, HomeKit communications bypass the HomeHub and are sent directly between devices.

**Comment by TheEngineerGuy** [comment]
That is correct. Via MDNS queries, homebridge retains a database of all devices locally subscribed to Multicast group 224.0.0.251. When a notification needs to go out, homebridge sends it as a TCP unicast to all devices in its Database.

**Comment by iRayanKhan** [comment]
> I could have given you mine.

Lol, isn't it like $70? It was when I last checked.

>
@iRayanKhan should we assume that Erik is saying that he 'does not' have any issues with notifications? I'm guessing the sensors he's talking about are at least partially from Homebridge.

Yeah, seems safe to assume that his plugin doesn't;t have notification issues.

**Comment by TheEngineerGuy** [comment]
Hmm... So what are you thinking @iRayanKhan ? Is his implementation of notifications any different than yours? Like the method or function calls etc.

**Comment by iRayanKhan** [comment]
The main point he made was to use ```set.Value()```, but I will dive further into his implementation.
The API version also has changed, this plugin seems to be fine with the new change.

**Comment by TheEngineerGuy** [comment]
Thanks @iRayanKhan looking forward to it my friend.

**Comment by DMBlakeley** [comment]
Just a piece of info, I am getting garage open notifications on my iPhone but not door close. The Key app is providing both open and close notifications.

**Comment by iRayanKhan** [comment]
At least 1 works lol. 
I have to wait for my parents to move their cars out the garages so I can re-connect them to Wi-Fi. But with the whole virus stuff, they don't want to move their cars, even to the driveway. 

Seems like we'er getting closer, I'm going to see what I can do from the hue plugin.

Stay safe everyone.

**Comment by twentyNoise** [comment]
FYI, hue plugin still getting 100% notifications with a motion sensor. Alarm Dot Com plugin still about the same as this plugin. Whatever you find will definitely be valuable for others as well.

**Comment by TheEngineerGuy** [comment]
Hey @iRayanKhan any news my friend?

**Comment by iRayanKhan** [comment]
Not at the moment. I may integrate an API into the plugin as a last last resort that can sniff notifications, and use that to trigger notifications. But Chamberlain just deprecated v4.x and V5.0 in favour for V5.1 so maybe some changes soon?

**Comment by TheEngineerGuy** [comment]
Ok, that makes sense. Do we know what the changelog for v5.1 is?

**Comment by iRayanKhan** [comment]
No clue, since this is a hacky api. Chamberlain provides nothing officially.

**Comment by TheEngineerGuy** [comment]
Well that's a bummer. So, how do you figure it out?

**Comment by iRayanKhan** [comment]
Whenever the plugin stops working, you just bump up the api version. As for user-agent, if someone finds it I accept their PR, or do it my self.

**Comment by TheEngineerGuy** [comment]
Did you get a chance to look at:
https://www.npmjs.com/package/iobroker.myq and
https://www.npmjs.com/package/node-myq

They were updated quite recently

**Comment by TheEngineerGuy** [comment]
Not sure if you saw my previous message @iRayanKhan , but here is another item I wished to run by here.

Is there a reason why, when door state changes, we are changing 'doorstate' and 'desireddoorstate'?

I wonder if this throws homekit to think that, this new state was a desired or requested state, so it doesn't need to notify on it.

Can we update to only change 'doorstate' and see if that helps?

**Comment by DMBlakeley** [comment]
What I am finding when trying to understand the inner workings of the Homebridge plugins is to look at the [HomeKit Characteristic Types](https://developer.apple.com/documentation/homekit/hmcharacteristic/characteristic_types) to see how the HomeKit accessory characteristic is defined.

For a door / garage door there is both HMCharacteristicTypeCurrentDoorState as well as HMCharacteristicTypeTargetDoorState. So, both are legitimate characteristics.

**Comment by TheEngineerGuy** [comment]
Correct, both are legitimate characteristics. One seems to notify and update switch state, but the other seems to request and trigger a change if 'desired state' does not match the 'current state'.

EDIT: And I am just thinking that if we send both, it may cause homekit to not send out a notification, as the requested state matches the change state.

**Comment by iRayanKhan** [comment]
I don’t know how correlated this is, but these are my findings.

I recently got some eero’s for HomeKit secure router, and after re-adding my devices to the MyQ app, I get consistent notifications now. 


I am considering learning TypeScript and rewriting this plugin, but this is not confirmed yet. 

Also I looked at those node implementations and they seem viable. Just waiting for school to ease up a little bit so I can tinker with them and see if I can implement a better protocol.

**Comment by TheEngineerGuy** [comment]
And @iRayanKhan Do take a look at the iobroker.myq link I posted above. They have implemented every single MyQ state in it. The most comprehensive MyQ implementation I have seen till date, but it is for IOBroker and not homebridge.

**Comment by iRayanKhan** [comment]
I am considering re-writing this plugin from scratch to be based off that broker, but unsure at the moment. School ends this month so I should get some time to do more work on this plugin, as school is the priority at the moment.

I hope everyone is staying safe.

**Comment by iRayanKhan** [comment]
I sent some emails out to some people and right after I sent the email I found some answers.

This [plugin](https://github.com/Haba1234/homebridge-iobroker)  exposes switches for ioBrokers. That means you will have to setup the broker then the plugin which isn't ideal. So I may have to combine several repos to achieve a full integration. This may or may not work, but hey it's worth a shot. This will/should add obstruction detection, proper states, notification fixes, etc. If anyone knows a better way to link ioBrokers into home bridge please link it.

**Comment by TheEngineerGuy** [comment]
Hi @iRayanKhan I was thinking that we could look at its source code and see how it queries the myq servers, handles the timers, handles the states etc. Not suggesting we should use it, just learn from it and implement it here. The logic that it has is quite different from our implementation. It uses a different URL as well, myqexternal.myqdevice.com.

**Comment by mbierman** [comment]
> This is not a homebridge problem. ECONNRESET is a TCP reset generated by Server being contacted, which in this case is MyQ server.
> 
> Yes, we need to gracefully handle this error, and retry when this error is generated, but updating homebridge is not going to fix it.

Ah, just saw your reply. Am I understanding correctly that this is purely on the MyQ server side and not an indication of any issue on my LAN?

**Comment by gamertyke** [comment]
I am seeing the same behavior with sporadic notifications accompianied by 

`"FetchError: request to https://api.myqdevice.com..."`

Additionally, a lot of the time when I ask Siri to open/close a door, she'll hang, then say "I tried however the Garage Garage Door didn't respond," but then it will actually work a few seconds later. Just thought I'd add my experience if it helps at all.

**Comment by beyerjp** [comment]
> I am seeing the same behavior with sporadic notifications accompianied by
> 
> `"FetchError: request to https://api.myqdevice.com..."`
> 
> Additionally, a lot of the time when I ask Siri to open/close a door, she'll hang, then say "I tried however the Garage Garage Door didn't respond," but then it will actually work a few seconds later. Just thought I'd add my experience if it helps at all.

I am also seeing the same thing since upgrading to the newest version of Homebridge. Did you just upgrade as well?

Thanks!

**Comment by gamertyke** [comment]
Yes, it worked quite well for a while, but recently started doing that. I actually just noticed a new new version of Homebridge is out, so I'm going to upgrade and see if that helps.

**Comment by TheEngineerGuy** [comment]
This is not a homebridge problem. ECONNRESET is a TCP reset generated by Server being contacted, which in this case is MyQ server.

Yes, we need to gracefully handle this error, and retry when this error is generated, but updating homebridge is not going to fix it.

**Comment by mbierman** [comment]
It is worse now. 

Module|Version
--- | ----
Node.js  |12.16.3
NPM|6.14.5
homebridge| 1.1.0
Alpine Linux (running in a Docker on a Synology)|3.11.6
homebridge-chamberlain|1.6.0
homebridge-nest|4.4.6 


	[5/18/2020, 9:16:28 AM] [Garage Door] FetchError: request to https://api.myqdevice.com/api/v5.1/Accounts/***/devices/***failed, reason: read ECONNRESET
	    at ClientRequest.<anonymous> (/homebridge/node_modules/homebridge-chamberlain/node_modules/node-fetch/lib/index.js:1455:11)
	    at ClientRequest.emit (events.js:310:20)
	    at TLSSocket.socketErrorListener (_http_client.js:426:9)
	    at TLSSocket.emit (events.js:310:20)
	    at emitErrorNT (internal/streams/destroy.js:92:8)
	    at emitErrorAndCloseNT (internal/streams/destroy.js:60:3)
	    at processTicksAndRejections (internal/process/task_queues.js:84:21) {
	  type: 'system',
	  errno: 'ECONNRESET',
	  code: 'ECONNRESET'
	}

Many in a row this morning. I am happy to provide any additional information you need if I left something important out or run any tests you like to help.

**Comment by mbierman** [comment]
> I am seeing the same behavior with sporadic notifications accompianied by
> 
> `"FetchError: request to https://api.myqdevice.com..."`
> 
> Additionally, a lot of the time when I ask Siri to open/close a door, she'll hang, then say "I tried however the Garage Garage Door didn't respond," but then it will actually work a few seconds later. 

I've seen the same.

**Comment by dinof40** [comment]
Hi, just to add to this thread a thought. I too am receiving the ECONNRESET errors frequently and am not receiving alerts. But I also regularly get errors using the actual Merlin/Chamberlin app "Garage Door is not responding, Please try again." but most of the time the app still works. Do you think this is the same issue and it's actually something their end?

Rasberyy Pi Zero W - Raspbian GNU/Linux Buster (10)
node v12.16.2
npm 6.14.4
homebridge 1.1.0
homebridge-config-ui-x v4.19.0
homebridge-chamberlain v1.6.0

iOS 13.4.1

**Comment by iRayanKhan** [comment]
I have been contacted beyond Github by several people that they had their garages not respond in either HomeKit, the app, or both. It eventually fixed itself after a while, but it could be on their end.

Can someone try PR #100 to see if that resolves their issue? I will be able to push that PR to npm later if you need to install it that way.

**Comment by gamertyke** [comment]
Hey Ryan, happy to help test, but I'm a bit of a noob. I'm running Homebridge in docker, what's the best way to pull this test version of the plugin?

**Comment by iRayanKhan** [comment]
Looks like the official MyQ homebridge product to add native HomeKit support also has delayed notifications. [Reddit Discussion](https://www.reddit.com/r/HomeKit/comments/gnbh7q/homekit_myq_alerts_incorrect_or_delayed/?utm_source=share&utm_medium=ios_app&utm_name=iossmf)

**Comment by TheEngineerGuy** [comment]
Till @iRayanKhan is working on getting this app recoded, as he suggested, we should give hime some space.

In the meantime we can use MyQ2 plugin, I have been using it for over a month now and notifications are pretty much immediate.

**Comment by TheEngineerGuy** [comment]
> Looks like the official MyQ homebridge product to add native HomeKit support also has delayed notifications. [Reddit Discussion](https://www.reddit.com/r/HomeKit/comments/gnbh7q/homekit_myq_alerts_incorrect_or_delayed/?utm_source=share&utm_medium=ios_app&utm_name=iossmf)

yes, the official MyQ homebridge sucks. I gave mine away a few weeks ago.

**Comment by iRayanKhan** [comment]
I haven’t looked into the source code of that plugin as deeply, I can see what it is doing differently with notifications and try it here.

**Comment by iRayanKhan** [comment]
Just published with tag ```rc3``` 

The version is 1.6.2-beta.1

Please report any feedback from this beta release and reply here.

**Comment by hdcola** [comment]
> Checking the logs, I see the following, is this a concern and what could be the cause?
> 
> 0|homebrid | [11/17/2019, 00:54:28] [Garage Door] FetchError: request to https://api.myqdevice.com/api/v5/accounts/<Account_ID>/devices/<Device_ID> failed, reason: read ECONNRESET
> 0|homebrid | at ClientRequest. (/usr/lib/node_modules/homebridge-chamberlain/node_modules/node-fetch/index.js:133:11)
> 0|homebrid | at ClientRequest.emit (events.js:210:5)
> 0|homebrid | at TLSSocket.socketErrorListener (_http_client.js:406:9)
> 0|homebrid | at TLSSocket.emit (events.js:210:5)
> 0|homebrid | at emitErrorNT (internal/streams/destroy.js:92:8)
> 0|homebrid | at emitErrorAndCloseNT (internal/streams/destroy.js:60:3)
> 0|homebrid | at processTicksAndRejections (internal/process/task_queues.js:80:21) {
> 0|homebrid | name: 'FetchError',
> 0|homebrid | message: 'request to https://api.myqdevice.com/api/v5/accounts/<Account_ID>/devices/<Device_ID> failed, reason: read ECONNRESET',
> 0|homebrid | type: 'system',
> 0|homebrid | errno: 'ECONNRESET',
> 0|homebrid | code: 'ECONNRESET'
> 0|homebrid | }
> 
> # Info
> iOS Version: 13.2.2
> Plugin Version: latest
> HomeBridge Version: latest
> Node/Npm Version: 12.13 / 6.12
> 
> Also, this is probably related to iOS 13 (HomeKit just acting weird), but, I don't get consistent notifications on my phone when garage opens/closes...I sometimes randomly get an Open or Close status, but, very very sporadic.
> 
> Let me know.

I had the same problem on my raspbian system.

homebridge-chamberlain v1.6.1

**Comment by iRayanKhan** [comment]
Working on updating the debugger. Will implement this in the next update, before V2.0/2.1. 

I may have a debug beta within 3 or so days

**Comment by hdcola** [comment]
Thank you very much and looking forward to the new release!

**Comment by SidShaytay** [comment]
On `1.6.1` I'm seeing a lot of
 
```
[8/6/2020, 10:53:41 AM] [Garage Door] FetchError: request to https://api.myqdevice.com/api/v5.1/Accounts/*****/devices/************ failed, reason: connect ENETUNREACH 13.83.97.206:443
    at ClientRequest.<anonymous> (/homebridge/node_modules/homebridge-chamberlain/node_modules/node-fetch/lib/index.js:1455:11)
    at ClientRequest.emit (events.js:315:20)
    at TLSSocket.socketErrorListener (_http_client.js:426:9)
    at TLSSocket.emit (events.js:315:20)
    at emitErrorNT (internal/streams/destroy.js:92:8)
    at emitErrorAndCloseNT (internal/streams/destroy.js:60:3)
    at processTicksAndRejections (internal/process/task_queues.js:84:21) {
  type: 'system',
  errno: 'ENETUNREACH',
  code: 'ENETUNREACH'
}
```

errors just like the others. I tried `1.6.2-beta.1` but that gives other errors like

```
[8/6/2020, 11:27:41 AM] [Garage Door] Error: invalid response, got HTTP 400: {
    "SecurityToken": "",
    "ReturnCode": "0",
    "ErrorMessage": "please contact customer care, supportID: " **************",
    "CorrelationId": ""
}
    at /homebridge/node_modules/homebridge-chamberlain/src/api.js:26:15
    at processTicksAndRejections (internal/process/task_queues.js:97:5)
```

I didn't update the plugin configuration (user/pass etc) during the update and when reviewing it, I see the right values.

I also see `2.0.3-beta.1` at [npm](https://www.npmjs.com/package/homebridge-chamberlain). 

What's the deal with 2.0.x series? Perhaps update the root readme.md here in this repo for 1.x and 2.x changes/awareness?

**Comment by iRayanKhan** [comment]
Closing: This plugin is now being deprecated. Please use [this](https://github.com/hjdhjd/homebridge-myq) plugin.
